uuid,name,description,region,symptoms,crude_drags,prescriptions,treatment,references
5a0e36ed22e4416d8ae368cd2b36eeaf,湿熱擾動,"ねあせでは最もよくみられる病変である.飲食の不摂生・飲酒癖・精神的ストレスなどで,牌胃の運化が失調して水湿が生じ,長期間停滞し化熱して湿熱となり,夜間に衛気が裏に入って湿熱と相争するために邪熱が強くなり,衛気の固護の不足に乗じて邪熱が外泄すると同時に津液を外に漏らし,ねあせが発生する病態である.湿熱は体内では蒸籠を蒸し上げるょっに津液を押し上げるので,頭面部に汗が出やすい.",全身,"じっとりとしたねあせ(首から上に多い)とともに,口が粘る・体が重だるい・むくみ・吐き気・腹満・尿が濃い・舌苔が黄賦・脈がやや速いなどの湿熱の症状がみられる.","清熱利湿の菌蔯蒿・薏苡仁・山梔子・滑石,清熱燥湿の黄連・黄芩・黄柏など.",菌蔯五苓散・菌蔯蒿湯・梔子柏皮湯,熱を冷ますと同時に湿邪を発散したり尿として除く.〈清熱利湿〉を行う.,"森 雄材,「漢方・中医学臨床マニュアル症状から診断・処方へ」, 医歯薬出版株式会社, 2004/02/01, ISBN 4263201957"
3e06b30260c2452e9b442fc380adad41,風寒犯肺・水湿内停,"風寒の邪が肺を侵襲し,宣散・粛降を阻滞する病態である寒冷の時期にみられる突発性の浮腫に相当する.",全身,"眼瞼に初発し頭面部から次第に全身に浮腫が拡大し,悪寒・発熱・頭痛・体の痛み・尿が少ない,脈が浮などを伴う.",麻黄・桂枝・防風・蒼朮・白朮など.,小青竜湯・麻黄加朮湯,"温めて汗をかかせ,体表部から外邪や水分を除き利尿する,〈疏風散寒・祛湿〉を行う","森 雄材,「漢方・中医学臨床マニュアル症状から診断・処方へ」, 医歯薬出版株式会社, 2004/02/01, ISBN 4263201957"
ea015c13ac0941cf804ff0f23bc85624,風熱犯肺・水湿内停,"風熱の邪が怖を侵犯し,宣散・粛降を阻害する病態である.アレルギー・急性腎炎など炎症性の突発性浮腫に相当し,季節を問わずにみられる.",全身,"眼瞼に初発し頭面部から全身に拡がる浮腫とともに,発熱・咽痛・咽の腫脹発赤・咳・尿が濃く少ない・血尿・舌苔がやや黄・脈が速いなどが現れる.","麻黄と石膏の組み合わせを用い,宣肺祛湿の連翹・桑白皮・薏苡仁・小豆などを配合する.",越婢加朮湯,"体表部からの熱の放散を強め,外邪を除き炎症を抑えて利尿する,〈辛涼宣肺・清熱祛湿〉を行う.","森 雄材,「漢方・中医学臨床マニュアル症状から診断・処方へ」, 医歯薬出版株式会社, 2004/02/01, ISBN 4263201957"
6b3c29f4fe434cce930d2cd38ae2caaa,少陽枢機不利,"人体の気と津液の通路で少陽の部位にある三焦が,様々な要因によって邪魔されて時に通じにくくなり,軽度の浮腫や機能障害が反復する病態である.自律神経失調の一種に相当する.",全身,"軽度の浮腫が反復し,いらいら・口が苦い・めまい・胸脇部が脹って苦しい・吐き気・食欲不振・尿が少ない・だるい・疲労感・汗をかきにくいなど多様な全身症状が反復したり出没する.脈は弦で,無力ではない.",柴胡・半夏・生菱・茯苓・沢瀉など.,小柴胡湯・柴苓湯,"少陽部位での気と津液を順調に流通させる,〈通調少陽枢機・利水〉を行う.","森 雄材,「漢方・中医学臨床マニュアル症状から診断・処方へ」, 医歯薬出版株式会社, 2004/02/01, ISBN 4263201957"
da4e12d8bb75472fa9b3e5beb4cc94f2,湿滞,"外来の湿邪が肌膚(皮下の軟部組織)に侵入したり 牌胃の運化を阻滞して内湿を生じ,内外の湿邪が肌膚に停滞したために浮腫が生じる病態である.湿気の多い環境での居住や作業が続いて湿気が体内に侵入したり,湿気により水分の発散が妨げられて体内に水分が停滞し,慢性あるいは反復性にむくみを生じる.水分は下方に貯留しやすいので下肢のむくみを呈しやすく,また湿気が胃腸を障害しやすいために消化器症状を伴うことが多い.なお,寒邪が加わると寒湿に,熱邪が加わると湿熱に変化する.",全身,"下肢のむくみとともに,体が重だるい・腹満・泥状便・尿が少ない・汗をあまりかかない・賦苔・脈に力があるなどがみられる.寒湿では冷え・舌苔が白滑・脈がやや遅いなどが,湿熱ではほてり・熱感・頭からの発汗・口が粘る・黄賦苔・脈がやや速いなどが加わる.",半夏・蒼朮・茯苓・猪苓・沢瀉など.,四苓湯・五苓散・胃苓湯・苓姜求甘湯・桂枝加苓朮附湯・菌蔯五苓散・猪苓湯,"停滞している水分を正常に流通させたり尿として排泄させる,〈祛湿利水〉を行う.","森 雄材,「漢方・中医学臨床マニュアル症状から診断・処方へ」, 医歯薬出版株式会社, 2004/02/01, ISBN 4263201957"
8d92e35c0d90413897b20d6d5fde77f5,脾虚湿滞,"先天的虚弱・老化・慢性病などによる牌気の衰弱,あるいは湿滞の状態の持続や反復による牌気の損傷で,牌が虚して津液の運輸が低下し,三焦で停積した津液が利用できない水分に変化し,水液が肌表にあふれた病態である.肺気にも影響が及んで,肺気のうち体表を固護する衛気が不足し,「衛虚」を伴うことも多い.",全身,"下半身に明らかな浮腫がみられ,食欲不振・味がない・元気がない・体が重だるい.疲れやすい・泥状便~水様便・尿が少ない・舌質が胖・舌苔が白・脈が弱いなどの症状がみられる.衛虚を伴うときは,汗をかきやすい・かぜをひきやすいなどの症状が加わる.",人参・白朮・茯苓・猪苓・薏苡仁など.,参苓白朮散・六君子湯合五苓散・防巳黄耆湯・防巳茯苓湯,"脾による吸収や津液の運輸の機能を高め,元気をつけて尿の排出を促進する,〈益気健脾・利水〉を行う.","森 雄材,「漢方・中医学臨床マニュアル症状から診断・処方へ」, 医歯薬出版株式会社, 2004/02/01, ISBN 4263201957"
bb450be21860421d976b2f888251adf9,陽虚湿盛,"慢性病・老化などで,主に腎の陽気による温煦(温める機能)と「蒸騰気化」が衰え,水分の排出ができなくなったために浮腫が発生する病態である.体の諸機能が衰弱し熱量の産生が不足し,体内が冷えて気機が渋滞し,蒸騰気化が低下して水分の排出ができなくなり,浮腫を生じた状態に相当する.場合によっては全身の高度の浮腫・胸水・腹水・呼吸困難・尿が出ないなどを呈し,衰弱して死亡に至ることもある.入院加療の必要もある.",全身,,,,,"森 雄材,「漢方・中医学臨床マニュアル症状から診断・処方へ」, 医歯薬出版株式会社, 2004/02/01, ISBN 4263201957"
95b9f8a9003d4d078eb7a85a41dee297,脾腎陽虚・湿盛,"脾・腎の陽気が衰弱して温煦ができず,冷えにより気機が渋滞し,脾の運輸と腎の蒸騰気化が低下して水分が停留し,肌膚にあふれで浮腫を呈する病態である.",全身,"下半身を主とする高度の浮腫と尿量減少があり,冷え・寒がる・食欲不振・泥状便・体が重だるい・元気がない・舌質が胖大・舌苔が白滑・脈が沈で遅いなどの症状を伴う.","温腎の附子・肉桂・乾姜,健脾利水の白朮・茯苓など.",真武湯・実脾散,"体を温めて機能と活力を増強し,水分の運輸と蒸騰気化を強めて排泄を促進する.〈温腎健脾・利水〉を行う.","森 雄材,「漢方・中医学臨床マニュアル症状から診断・処方へ」, 医歯薬出版株式会社, 2004/02/01, ISBN 4263201957"
9567a24e1b394d45a521bb2469f546f8,腎陽虚・湿盛,"腎陽が虚衰し,蒸騰気化が不足して水分を排出できないために停積して浮腫を生じる病態である.",全身,"下半身を主とする浮腫と尿量減少があり,冷える・寒がる・腰や膝がだるく無力・舌質が胖大・脈が沈で遅いなどを伴う.","温補腎陽の附子・肉桂・鹿角膠・熟地黄,補腎利水の牛膝・車前子など.",牛車腎気丸,"体を温め活力をつけて蒸騰気化を強め,水分の排泄を促進する.〈温補腎陽・利水〉を行う.","森 雄材,「漢方・中医学臨床マニュアル症状から診断・処方へ」, 医歯薬出版株式会社, 2004/02/01, ISBN 4263201957"
7fd908f2ff2746d6b4d1a3581cee43fd,血虚湿盛,"月経異常・出産・慢性病・出血などによる消耗,牌虚による血の生成不足などで,血の濡養が不足することにより気機が失調し,津液の流通が悪くなって停積し,利用できない水分に変化して浮腫を生じる病態である.",全身,"むくみ・浮腫のほか,顔色が悪い・度膚につやがない・月経の遅れ・経血が少ない・四肢のしびれ感・舌質が淡白・脈が細いなどの血虚の症状が現れる.血虚のために柔肝ができず,肝気の疏泄が失調するときは,ゅううつ・いらいら・ヒステリックな反応・怒りっぽい・脈が弦で細いなどがみられる.","補血の当帰・白芍・川芎,利水の白朮・茯苓・猪苓など.",当帰芍薬散・帰芍六君子湯・逍遙散・加味逍遙散・四逆散合五苓散・柴芍六君子湯,"血を補い栄養・循環状態を改善し,津液の運輸を促進して水分の排出を促す,〈補血利水〉を行う.","森 雄材,「漢方・中医学臨床マニュアル症状から診断・処方へ」, 医歯薬出版株式会社, 2004/02/01, ISBN 4263201957"
e6d9a3c92fd240029b3d2aa75427fe64,陰虚湿滞,"熱病・慢性病などで陰液が消耗して内熱が生じ,体内の水液が濃縮されて流動性が悪くなるために停留して浮腫を呈する病態である.乾燥症状とともに浮腫がみられるのが特徴であるが,頻繁に現れる病態ではなく,かなり重篤である.",全身,"下半身を主とする浮腫に,るい痩・皮膚の乾燥・口や咽の乾燥・ほてり・熱感・腰や藤がだるく無力・舌質が絳で乾燥・脈が浮で速く力がないなどを伴う.","滋陰の生地黄・玄参・麦門冬・阿膠,利水の猪苓・沢瀉など.",六味丸合猪苓湯,"滋陰により体液を補充し,栄養を与えながら水分の流動性を回復させて排出する,〈滋陰利水〉を行う.","森 雄材,「漢方・中医学臨床マニュアル症状から診断・処方へ」, 医歯薬出版株式会社, 2004/02/01, ISBN 4263201957"
74857980cb0e4434a78164f0599c583b,虚証,"体に必要不可欠な機能的・物質的要素である「正気」が不足した状態であり,先天的虚弱・老化・慢性病による消耗・過労・精神的ストレスによる消耗などで発生するほか,熱病の回復期・激しい発汗や吐瀉の後・出血の後などにも現れる.正気には,大きく分けて陽気(気)と陰液(血・津液・精)の別がある.陽気は主に機能を,陰液は主に物質を代表する.ただし,陽気は陰液を元にして生じ,陰液は飲食物から陽気の作用を通じて産み出されるので,陰液と陽気には相互に深い関連性がある.疲労倦怠感は,陽気の不足すなわち機能の低下が直接引き起こす症状である.しかし,陽気の不足が陰液の産生を減少させたり,陰液の不足から陽気の発生が不十分になるというように,陽気不足の半面として陰液不足が関与していることが多い.陽気が不足すると,元気がない・気力がない・生気がない・おとなしくもの静かである・横になりたがる・動いたりものをいうのがおっくうである・朝が起きにくい・すぐに疲れる・脈が弱いなど,精神・身体両面の機能低下による無力症状がみられる.陰液の不足を伴うときには,さらにるい痩・色つやが悪い・筋肉が柔らかく張りがない・爪がもろい・毛髪につやがないなどが現れる.",全身,,,,,"森 雄材,「漢方・中医学臨床マニュアル症状から診断・処方へ」, 医歯薬出版株式会社, 2004/02/01, ISBN 4263201957"
9b1637120041498990b262f0cff75957,腎陽虚,"先天的虚弱・老化・慢性疾患などで,腎の陽気が衰えた状態である.",全身,"疲労倦怠・元気がない・活力がないなどの無力症状とともに,視覚・聴覚・味覚・触覚など知覚の鈍麻,生殖能力・知能・運動能力などの衰え,さらに冷え・寒がる・舌質が胖・舌苔が白滑・脈が沈で遅く弱いなどの虚寒の症状を伴う.","「血肉有情の品」と呼ばれる動物薬の鹿茸・紫河車・鹿角膠,および補陽の杜仲・菟絲子・附子・肉桂など.",右帰丸・亀鹿二仙膠,"体を温めて元気をつける,〈補陽〉を行う.","森 雄材,「漢方・中医学臨床マニュアル症状から診断・処方へ」, 医歯薬出版株式会社, 2004/02/01, ISBN 4263201957"
ae3b06f85f1543908c9e132caa8ed3c7,気虚,"慢性病・鹿弱体質・過労などによる,気の不足すなわち機能低下の状態である.",全身,,,,,"森 雄材,「漢方・中医学臨床マニュアル症状から診断・処方へ」, 医歯薬出版株式会社, 2004/02/01, ISBN 4263201957"
c14515d3504d4492834e254f5fce5c9f,脾胃気虚,脾胃の運化が低下して水穀の精微を全身に供給できないために疲労倦怠感を引き起こす病態である.さらに進行して陽気の温煦が低下すると陽虚が現れる.消化吸収機能が悪くなってエネルギーの供給が不足した状態に相当する.,全身,"疲れやすい・元気がない・四肢がだるい・脈が弱いなどとともに,食欲不振・味がない・少ししか食べられない・消化が悪い・泥状便~水様便・腹が脹るなどの消化器症状がみられる.牌胃陽虚では,さらに寒がる・冷え・脈が沈で遅いなどの虚寒の症状がみられる.",人参・白朮・茯苓・炙甘草など.,四君子湯・六君子湯・人参湯(理中湯)・附子理中湯,"脾胃の運化すなわち消化吸収機能を高めて元気を出させる,〈健脾益気〉を行う.","森 雄材,「漢方・中医学臨床マニュアル症状から診断・処方へ」, 医歯薬出版株式会社, 2004/02/01, ISBN 4263201957"
6091100f31ef497296abaa4bfa3fb3c6,気虚下陥,"気が不足して昇挙する能力が低下し,気機が下陥する病態である.筋力が低下したアトニー状態に相当し,支持組織の緊張低下による内臓の下垂傾向がみられるほか,血管抵抗が弱くなり重力に抵抗して血液を上部に送る能力が低下するために虚血性の頭部症状もよく現れる.",全身,"疲れやすい・元気がない・倦怠感・脈が沈で弱いなどとともに,胃下垂・遊走腎・脱肛・子宮下垂・下腹部の下墜感などの下垂症状,立ちくらみ・ふらつき・めまい・頭痛・肩こりなどの上部の虚血性の症状がみられる.",黄耆・人参・柴胡・升麻・葛根など.,補中益気湯・挙元煎,"諸機能を活発にし筋の緊張を高める,〈益気昇陥〉を行う.","森 雄材,「漢方・中医学臨床マニュアル症状から診断・処方へ」, 医歯薬出版株式会社, 2004/02/01, ISBN 4263201957"
44d5ecefac5947a395fc901296eddb05,気血両虚,"虚弱体質・老化などによる気血の不足,慢性疾患・出産・出血などによる気血の消耗,気虚が慢性に経過して血の産生が不足するなどの原因で,気虚と血虚の両面が発生する病態である.機能低下だけでなく,栄養面や循環血液量の低下も伴う状態に相当する.",全身,"元気がない・疲れやすい・倦怠感・息切れ・脈が弱いなど気虚の症状以外に,顔色につやがない・皮膚のきめが粗い・爪がもろい・筋肉のひきつり・しびれ・目の疲れ・目のかすみ・眠りが浅い・夢をよくみる・目が覚めやすい・月経量が少ない・月経が遅れる・舌質が淡白・脈が細いなどの血虚の症状を伴う.","補気の人参・黄耆・白朮,補血の当帰・白芍・熟地黄・酸棗仁・竜眼肉など.",八珍湯・十全大補湯・人参養栄湯・帰脾湯,"機能を高めるとともに血を補い栄養状態を改善する,〈気血双補〉を行う.","森 雄材,「漢方・中医学臨床マニュアル症状から診断・処方へ」, 医歯薬出版株式会社, 2004/02/01, ISBN 4263201957"
ce0c3e0f92554062a64d0e000ae58d2c,気津両傷,"熱病・暑熱の環境・激しい運動や労働,あるいは激しい吐潟・利尿剤の服用過多などにより,気と津液を消耗した病態で,かなり急性に生じる.気力と体液(津液)が失われた状態に相当する.熱病の回復期によくみられるほか,夏パテのー形態として季節的に現れることが多い.",全身,"元気がない・倦怠感・疲労感・息切れ・動きたくない・脈が弱いなどの気虚の症状以外に,咽の掲き・水分を欲しがる・口唇や皮膚の乾燥・舌の乾燥など津液不足の乾燥症状がみられる.","益気生津の人参・炙甘草,生津の麦門冬・五味子・玉竹・天花粉・沙参など.",生脈散・清暑益気湯・沙参麦冬湯・益胃湯,"元気をつけ体液を補充する,〈益気生津〉を行う.","森 雄材,「漢方・中医学臨床マニュアル症状から診断・処方へ」, 医歯薬出版株式会社, 2004/02/01, ISBN 4263201957"
2836e393e114443e9d8dc9292c7b16c2,気陰両虚,"熱病・慢性病・老化などによる消耗で,気と陰液が同時に不足し虚熱を伴う病態である.体力や機能が低下すると同時に,栄養状態の悪化・体液の喪失・体内の異化作用亢進による熱量増加などが加わった状態に相当する.",全身,"元気がない・倦怠感・疲労感・息切れ・だるい・脈が弱いなどの気虚の症状以外に,るい痩・皮膚が乾燥してつやがない・咽の渇き・午後の熱感・手のひらや足の裏のほてり・頬部の紅潮・のぼせ・ねあせ・舌質が絳・少苔~無苔・脈が速いなど陰虚の虚熱症状がみられる.","益気の人参・炙甘草,滋陰の生地黄・玄参・麦門冬・天門冬など.",炙甘草湯,"元気をつけ機能を高めると同時に,栄養・体液を補充して虚熱を冷ます,〈益気滋陰〉を行う.","森 雄材,「漢方・中医学臨床マニュアル症状から診断・処方へ」, 医歯薬出版株式会社, 2004/02/01, ISBN 4263201957"
5c95ef526e884caba07aa58cc97db16e,気機不利,"様々な原因で気機,すなわち気の流れが円滑でなかったり停滞するために,突然にあるいは間歇的に疲労倦怠を感じる病態である.車にたとえると,ガソリンは十分にあるのに,途中のパルプの開閉がうまくいかなかったり,何かがパイプにつまり,エンジンが急激にあるいは時々不調になるような状態である.",全身,,,,,"森 雄材,「漢方・中医学臨床マニュアル症状から診断・処方へ」, 医歯薬出版株式会社, 2004/02/01, ISBN 4263201957"
875ca257c488425ba3a29307220d3015,少陽枢機不利,"気と津液の通路である三焦(少陽の部位)が,様々な要因によって邪魔されて時に通じにくくなる病態で,一時的に気機が停滞すると突然疲れ,まもなく気の流通が回復すると元に戻る.自律神経失調症の一つのタイプである.",全身,"突然疲れてまもなく回復するといった状態を繰り返すほか,いらいら・口が苦い・口の乾燥・めまい・目のかすみ・胸脇部が脹って苦しい・寒くなったり熱くなったりする・吐き気・食欲不振・動悸・咳・汗があまり出ない・むくみ・尿が少ない・脈が弦で無力ではないなどの,気・津液の流通失調による多彩な全身症状が出没し反復する.",柴胡・半夏・生姜・黄芩など.,小柴胡湯・柴胡加竜骨牡蛎湯・柴胡桂枝湯,"少陽での気の流れを順調にさせる,〈通調少陽枢機〉を行う.","森 雄材,「漢方・中医学臨床マニュアル症状から診断・処方へ」, 医歯薬出版株式会社, 2004/02/01, ISBN 4263201957"
2361481e0f424a5b93e07337b181011b,肝鬱気滞,"緊張・精神的ストレスなどにより肝気が鬱滞し,気機を疏泄できなくなる病態である.情緒系・自律神経系の緊張に伴う機能の停滞であり,精神的疲労に相当する.",全身,"精神的な原因で突然に疲労倦怠感が生じて反復し,抑うつ感・ゆううつ・やる気が出ない・いらいら・怒りっぽい・頭痛・不眠・ヒステリックな反応・脈が弦で有力などがみられる.体力的には衰えていないので,運動したり声を出したり,好きなことに没頭するといった肉体的・精神的な発散により,一時的にリラックスして疲労倦怠感が消失することが多い.ただし,肝鬱気滞の状態が長期にわたったり反復すると,次第に体力・気力が消耗して,虚証へと変化していく.早期にストレスを解除したり,治療によってストレスへの抵抗性を高める必要がある.",柴胡・香附子・青皮・鬱金・白芍など.,四逆散・柴胡疏肝散・逍遙散・加味逍遙散,"肝気をのびやかにして精神・機能を円滑に働かせるようにする,〈疏肝解鬱〉を行う.","森 雄材,「漢方・中医学臨床マニュアル症状から診断・処方へ」, 医歯薬出版株式会社, 2004/02/01, ISBN 4263201957"
14a2f3e7dfdc47b0a6b06c7831e1b8fc,湿滞,"様々な原因で体内に湿邪が停滞し,気機を阻滞する病態である.体内に水分が停滞し,余分な重量をかかえるために体が重だるく,また水分が血管を圧迫したり神経の機能や伝達を阻害して機能が悪くなる状態に相当する.",全身,,,,,"森 雄材,「漢方・中医学臨床マニュアル症状から診断・処方へ」, 医歯薬出版株式会社, 2004/02/01, ISBN 4263201957"
9b770c24c7a349309544cd9364a9041b,湿阻気機,"湿気の多い環境で外湿が侵入したり,飲食の不摂生などで脾胃の運化が阻害されて内湿が生じ,内・外の湿邪が気機を困阻する病態である.",全身,"倦怠感があり体が重だるく,むくみを伴うのが特徴で,食欲不振・吐き気・泥状便・頭がぼんやりする・いつも眠い・厚賦苔などを伴う.",蒼朮・白朮.薏苡仁・藿香・厚朴など.,藿香正気散・平胃散・胃苓湯,"水分を除去し気の流通を強める,〈理気祛湿〉を行う.","森 雄材,「漢方・中医学臨床マニュアル症状から診断・処方へ」, 医歯薬出版株式会社, 2004/02/01, ISBN 4263201957"
e7fd1f366db14b4ea534089d5875ee88,湿熱壅滞,"温熱の邪の侵襲・湿邪の停滞化熱・飲酒癖などが原因で,湿熱が停滞して気機を困阻する病態である.「湿熱燻蒸」といわれるように,熱で蒸し上げるような症状が現れる.体内の水分停滞と同時に炎症や神経系の興奮による熱症状を呈する状態で,ウイルス性疾患・自律神経失調症・飲酒癖・美食・大食などでよくみられる.",全身,"全身倦怠感・体が重だるい・むくみなど湿阻気機の症状のほか,頭からの発汗・口が粘る・強い口臭や体臭・腹満・下痢・微熱の起伏・尿が濃く少ない・悪臭のある帯下・甚だしいと黄疸・黄賦苔・脈がやや速いなどを伴う.",茵蔯蒿・滑石・山梔子・薏苡仁・赤小豆・車前子・猪苓・沢瀉など.,茵蔯蒿湯・茵蔯五苓散・五淋散・連朴飲・杏仁滑石湯,"湿を除くと同時に熱を冷ます,〈清利湿熱〉を行う.","森 雄材,「漢方・中医学臨床マニュアル症状から診断・処方へ」, 医歯薬出版株式会社, 2004/02/01, ISBN 4263201957"
