uuid,name,description,region,symptoms,crude_drags,prescriptions,treatment,references
1dc73950e04649a4bc7d2bbf70c1743a,胃熱,"胃は飲食物を腐熟して水穀の精微に変化させ,全身を栄養する原料を提供するが,辛媒なもの・熱すぎるもの・甘いもの・あぶらっこいものの嗜好や飲酒癖などで胃熱が生じ,胃熱のために腐熟が亢進しすぎて精微を産生できず,また邪熱が異化作用を亢進させて陰津を消耗するために,大量に飲食するにもかかわらず体を栄養できず,物質面の消耗も続いて,次第にるい痩する病態である.この病態が続くと,水穀の精微が少ないために陰液の産生が減少するうえに,邪熱が陰液を消耗するので,次第に陰虚へと移行する.",全身,"よく食べるがすぐに空腹になり,食べても食べても身につかずに痩せ,咽の渇き・水分をたくさん飲む・口臭・胸やけ・便秘・尿が濃い・暑がる・舌質が紅・黄色い舌苔・脈が速く力があるなどを伴う.",石膏・知母・生地黄・玄参・黄連など.,白虎湯・白虎加人参湯・竹葉石膏湯,"胃熱を冷まして腐熟を正常化し陰津の消耗を防止する,〈清胃瀉火〉を行う.","森 雄材,「漢方・中医学臨床マニュアル症状から診断・処方へ」, 医歯薬出版株式会社, 2004/02/01, ISBN 4263201957"
832dbddac8964451b117c6c699bb3667,心肝火旺,"精神的ストレス・悩み・怒り・過度の思慮・恋情などにより,心火・肝火が生じて火熱が陰血を損耗するためにるい痩する病態である.この病態が続くと陰血が引き続いて消耗し,次第に陰虚へと移行する.",全身,"いらいら・焦燥・怒りっぽい・ヒステリックな反応・不眠・頭痛・めまい・目の充血・のぼせ・ほてり・胸が熱苦しい・舌質が紅・黄色い舌苔・脈が弦で速く力があるなどがあり,食べても次第に痩せ,甚だしければ食べる気もなくなってるい痩する.","清肝瀉火の黄芩・山梔子・竜胆草,清心瀉火の黄連・生地黄・竹葉・連翹など.",竜胆瀉肝湯・三黄瀉心湯・黄連解毒湯・導赤散,"肝・心の邪熱を冷まして陰血の消耗を防ぐ,〈清肝瀉火・清心瀉火〉を行う.","森 雄材,「漢方・中医学臨床マニュアル症状から診断・処方へ」, 医歯薬出版株式会社, 2004/02/01, ISBN 4263201957"
df20a769ff3a4ab0b310e435f032f132,陰虚,"慢性病・老化・過労・熱病などによる消耗,あるいは胃熱・心肝火旺などの火熱による消耗で,陰液が損傷を受けてるい痩するが,陰虚によって生じる内熱のために常に陰液の耗損が続き,太ることができない病態である.心・肺・肝・腎の陰虚を区別する必要があり,基本的な病態は類似する.",全身,"るい痩して皮膚が乾燥し,体の熱感・午後や夜間に熱感が強い・手のひらや足の裏のほてり・ねあせ・舌質が絳で乾燥・少苔~無苔・脈が浮で速く力がないなどが共通してみられる症状である.心陰虚では,さらに不眠・もの忘れ・焦燥・動停などが現れる.肺陰虚では,慢性の乾いた咳・少痰~無痰・痰に血が混じるなどがみられる.肝腎陰虚では,視力減退・耳鳴り・筋肉のひきつり・手のふるえ・腰や膝がだるく無力などがみられる.","滋陰の生地黄・熟地黄・玄参・阿膠・亀板・鼈甲・百合・麦門冬・枸杞子,清虚熱の知母・牡丹皮・地骨皮など.","心陰虚には天王補心丹,肺陰虚には都気丸・百合固金湯・補肺阿膠湯,肝腎陰虚には六味丸・杞菊地黄丸・知柏地黄丸","陰液を滋潤するとともに,内熱持して消耗を防ぐ,〈滋陰清熱〉を行う.","森 雄材,「漢方・中医学臨床マニュアル症状から診断・処方へ」, 医歯薬出版株式会社, 2004/02/01, ISBN 4263201957"
4e72333b469b4e66b4a554d72caf4e43,脾胃虚損,"先天的虚弱・老化・慢性病・熱病・飲食の不摂生などによる消耗で,脾あるいは胃が衰弱した病態である.脾胃の虚損には,機能の不足である気虚と物質の不足である陰虚の別があるが,相互に関連している.",全身,,,,,"森 雄材,「漢方・中医学臨床マニュアル症状から診断・処方へ」, 医歯薬出版株式会社, 2004/02/01, ISBN 4263201957"
0ddf717c9c1046b281202acd9c38502e,胃気慮,胃気が不足して受納と腐熟ができない病態である.,全身,"食べられない・少し食べると上腹部が脹って満腹になる・吐き気・嘔吐・舌質が淡・脈が弱いなどの症状があり,次第にるい痩する.","和胃通降の半夏・陳皮・砂仁・生姜,益気の人参・白朮など.",小半夏湯・小半夏加茯苓湯・六君子湯・香砂六君子湯,"胃の機能を高めて受納と腐熟を正常にする,〈益気和胃〉を行う.","森 雄材,「漢方・中医学臨床マニュアル症状から診断・処方へ」, 医歯薬出版株式会社, 2004/02/01, ISBN 4263201957"
d904aa87cca64ca59ad2fd46d0125dd7,胃陰虚,"胃の陰液が不足したために気機が失調して,胃気が下降しなくなって受納も腐熟もできない病態である.",全身,"空腹感はあるが食べられない・少し食べると上腹部が脹って満腹になる・乾嘔・咽の渇き・水分を欲しがる・舌質が絳で乾燥・舌苔が少ない・脈が浮で速く力がないなどの症状があり,次第にるい痩する.",麦門冬・天門冬・沙参・玉竹・石斛・天花粉など,麦門冬湯・沙参麦冬湯・養胃湯・益胃湯,"胃の陰液を滋潤することにより,胃気を正常化して受納と腐熟を行わせる,〈滋養胃陰・和胃〉を行う.","森 雄材,「漢方・中医学臨床マニュアル症状から診断・処方へ」, 医歯薬出版株式会社, 2004/02/01, ISBN 4263201957"
04512e39cf734b11ab93011e07201e43,脾気虚,脾気が不足して水穀の精微を吸収して運輸することができない病態である.,全身,"食欲不振・腹がすかない・食べたいと思わない・味がない・食べると腹が脹る・泥状便~水様便・舌質が淡・脈が弱いなどの症状があり,次第にるい痩し,元気がない・ものをいうのがおっくう・疲れやすい・動きたがらない・息切れなどを伴う.","健脾の自朮・茯苓・炙甘草・大棗,益気の人参・黄耆・党参など.",四君子湯・異功散・六君子湯,"脾の機能を高めて吸収と運輸を正常にする,〈益気健脾〉を行う.","森 雄材,「漢方・中医学臨床マニュアル症状から診断・処方へ」, 医歯薬出版株式会社, 2004/02/01, ISBN 4263201957"
561002a4d9664026ae06de6091412ef0,脾気陰両虚,"脾気が不足して,水穀の精微の吸収と運輸が不十分になるために,陰液の供給が不足して次第に脾陰も不足し,気機が失調して脾の運輸がより悪化する病態である.",全身,"脾気虚の症状以外に,口唇の乾燥・皮膚につやがない・爪傍の角化・手足のほてり・口唇や舌質が紅・舌苔が少ないあるいは地図状・脈が浮で速いなどの症状がみられる.","滋補脾陰の山薬・蓮肉・芡実・薏苡仁・白扁豆,益気健脾の人参・白朮・炙甘草など.",四君子湯加山薬・資生湯・啓脾湯・参苓自朮散,"脾の陰液を滋潤して脾気を正常化させるとともに,脾気を補って吸収・運輸の機能を高める,〈滋補脾陰・益気健脾〉を行う.","森 雄材,「漢方・中医学臨床マニュアル症状から診断・処方へ」, 医歯薬出版株式会社, 2004/02/01, ISBN 4263201957"
5acdc95a107d468c87187badfefa6b8a,心火,思い・悩み・恋慕・欲求が遂げられないなどによって心気が亢盛になって化火し、心火が心神を擾動するためにいらいらが引き起こされる病態である。,精神・神経,焦燥感があっていても立ってもいられず、動悸・不安・胸が暑苦しい・不眠・舌尖が紅くしみるように痛む・口内炎・舌苔が黄・脈が速く有力などを伴う。,清心火の黄連・黄芩・山梔子・生地黄・連翹、安神の竜骨・牡蠣・磁石、心火を下行させて尿から除く木通・甘草梢など。,三黄瀉心湯・黄連解毒湯・導赤散・清心蓮子飲,心火を冷まして心神を安定させる、《清心安神》を行う。,"森 雄材,「漢方・中医学臨床マニュアル症状から診断・処方へ」, 医歯薬出版株式会社, 2004/02/01, ISBN 4263201957"
cf9444a6f4854265bf26e3c867e93490,肝火,精神的なストレス・怒り・情緒の抑うつなどによって、肝気が鬱して化熱し、肝火となって心神を擾乱するためにいらいらが生じる病態で、原因が除かれないか治療が不適切であれば、心火と同様に痰熱や陰虚へと移行し慢性化する。,精神・神経,いらいらして怒りっぽいと同時に、ヒステリックな反応・胸脇部が脹って痛む・頭痛・耳鳴り・口が苦い・舌の尖辺が紅・舌苔が黄・脈が弦で早く有力などがみられる。,清肝瀉火の竜胆草・黄芩・山梔子、疏肝の柴胡・香附子・白芍、安神の竜骨・牡蠣など。,竜胆瀉肝湯・加味逍遙散・柴胡疏肝散・柴胡加竜骨牡蛎湯・大紫胡湯,肝火を冷ますことによっていらいらを静める、《清肝瀉火・安神》を行う。,"森 雄材,「漢方・中医学臨床マニュアル症状から診断・処方へ」, 医歯薬出版株式会社, 2004/02/01, ISBN 4263201957"
463b486985b141d18d0426448ee7b38d,痰熱上擾,心火や肝火により津液が煮つめられて生じた痰が火熱と結びついて痰熱になったり、飲食の不摂生や飲酒癖で痰湿が内生し次第に化熱して痰熱に変化し、痰熱が心神を上擾するためにいらいらが生じる病態である。,精神・神経,いらいらとともに、不眠・驚きやすい・動悸・痰が多い・胸苦しい・めまい・吐き気・嘔吐・黄膩苔・脈に力があるなどがみられる。,化痰の半夏・陳皮・竹筎・桔梗・貝母、清熱の黄蓮・黄芩・山梔子など。,温胆湯・黄連温胆湯・竹筎温胆湯,熱を冷ますとともに痰を除く、《清熱化痰》を行う。,"森 雄材,「漢方・中医学臨床マニュアル症状から診断・処方へ」, 医歯薬出版株式会社, 2004/02/01, ISBN 4263201957"
b06d888930994118b72734a66323a1db,陰虚火旺,心火・肝火・痰熱などの火熱による陰液の消耗、慢性病・老化・過度の性生活・多産などに伴う消耗により、陰液が不足して陽気を抑制できなくなって内熱を生じ、内生した火熱が上亢して心神を擾乱するためにいらいらが生じる病態である。,精神・神経,いらいら・焦燥とともに、体の熱感・のぼせ・ほてり・口の乾燥・不眠・ねあせ・腰や膝がだるく無力・舌質が絳・少苔～無苔・脈が浮で速く力がないなどの陰虚の症状がみられる。,滋陰の生地黄・熟地黄・玄参・天門冬・表門冬・阿膠・滋陰潜陽の亀板・鼈甲、瀉火の知母・黄柏など。,知柏地黄丸・滋陰降火湯,陰液を滋潤して上亢している火熱を降下させる、《滋陰降火》を行う。,"森 雄材,「漢方・中医学臨床マニュアル症状から診断・処方へ」, 医歯薬出版株式会社, 2004/02/01, ISBN 4263201957"
c60c5492751743a385c1144229a036a2,心火,思い・悩み・恋慕・欲求が遂げられないなどによって心気が過度に亢盛して化火し、心火が心神を激しく乱すために不眠を引き起こす病態である。治療が不適切で原因が除かれないと、持続する心火が陰血を次第に消耗して、心陰虚や心腎不交などに移行する。,精神・神経,強い不眠で紋々として夜通し眠れず、眠っても夢をよくみてすぐに目覚め、胸が暑苦しい・焦燥・動悸・顔面紅潮・口が苦い・舌尖がしみるように痛む・口内炎の多発・舌尖が紅・舌苔が黄・脈が速く有力など上部の激しい興奮症状がみられる。,清心火の黄連・黄芩・山梔子・生地黄・連翹、安神の竜骨・磁石・竜骨・牡蠣、心火を下行させて尿から除く木通・甘草梢など。,三黄潟心湯・黄連解毒湯・赤導散 清心連子飲,心火を冷まして心神を安定させる、《清心安神》を行う。,"森 雄材,「漢方・中医学臨床マニュアル症状から診断・処方へ」, 医歯薬出版株式会社, 2004/02/01, ISBN 4263201957"
ee96288d4c6c4163a68864eb975dcf12,肝鬱化火,精神的なストレス・怒り・情緒の抑うつなどで肝気が鬱し、化熱して肝火となって心神を擾乱するために不眠が生じる病態である。多くの場合に肝火が心にも波及して心火を引き起こし、心肝火旺の状態になって甚だしい不眠が発生する。,精神・神経,あれこれ考えたりいらいらして寝つけず、眠っても夢をよくみてすぐに目覚め、朝早く起きてしまい、怒りっぽい・目の充血・頭痛・耳鳴り・胸脇部が脹って苦しい・舌の尖辺が紅・舌苔が黄・脈が弦で速く有力などの症状もみられる。,清肝解鬱の竜胆草・柴胡・黄芩・山梔子、安神の竜骨・牡蠣など。,竜胆潟肝湯,肝気を疏通し肝火を清泄して心神を安定させる、《清肝解鬱・安神》を行う。,"森 雄材,「漢方・中医学臨床マニュアル症状から診断・処方へ」, 医歯薬出版株式会社, 2004/02/01, ISBN 4263201957"
8dfd2fd2458c4a5d8cbd56fc55522816,胃気不和,暴飲暴食・飲食の不摂生・就寝前の飲食などにより胃内に食滞を形成し、不消化物による濁気が心神を上擾するために不眠が生じる病態である。ヨガで、寝る前に胃内の残渣を吐きもどすように指示しているのは、このためである。,精神・神経,なかなか寝つけず、眠っても夢をよくみてすぐ目覚め、腹満・げっぷ・腹痛・舌苔が厚・脈に力があるなどを伴う。,消導の麦芽・穀芽・萊菔子・山楂子・神麹、胃和の半夏・陳皮、瀉火の大黄など。,保和丸・枳実導滞丸,食滞を除き胃気を正常化する、《消食和胃》を行う。,"森 雄材,「漢方・中医学臨床マニュアル症状から診断・処方へ」, 医歯薬出版株式会社, 2004/02/01, ISBN 4263201957"
d2004007851d4b429c870278ac57cf79,痰熱擾心,飲食の不摂生・飲酒癖などで脾気が滞って痰湿が生じ、痰湿が胆気を鬱滞させて胆火を引き起こし、そのために痰湿が化熱して痰熱を生じたり、熱病の邪熱によって津液が濃縮されて痰熱に変化し、痰熱が上行して心神を乱すために不眠が生じる病態である。,精神・神経,いらいらして寝つきが悪い・夜中に驚いて目を覚ます・夢をよくみるなどとともに、口が苦い・吐き気・嘔吐・痰が多い・胸苦しい・黄膩苔・脈がやや速く力があるなどがみられる。,竹筎・半夏・胆南星・枳実・黄連・柴胡など。,温胆湯・黄連温胆湯・竹筎温胆湯・竹筎温胆湯・柴胡加竜骨牡蛎湯,熱を冷まして痰を除去する、《清熱化痰》を行う。,"森 雄材,「漢方・中医学臨床マニュアル症状から診断・処方へ」, 医歯薬出版株式会社, 2004/02/01, ISBN 4263201957"
91197c37fd0c49c3844084db751745c3,肝鬱血虚,精神的ストレス・緊張などによって肝気の疏泄が失調し、血を消耗したり脾胃の運化を失調させて気血の産生が不足するために、肝血が虚して柔肝できないので肝気をさらに失調させ、これにより心神が乱されて不眠が発生する病態である。,精神・神経,いらいらして寝つけない・眠りが浅い・すぐに目が覚めるなどとともに、怒りっぽい・ゆううつ・ため息・顔色につやがない・胸脇部が脹って苦しい・月経不順・舌質が淡・脈が弦で細いなどがみられる。,疏肝解鬱の柴胡・青皮・香附子・川芎、養血柔肝の白芍・当帰・熟地黄、健脾により生血を助ける白朮・茯苓、安神の酸棗仁湯,逍遙散・加味逍遙散・抑肝散加陳皮半夏・抑肝散・酸棗仁湯,肝の疏泄を順調にして鬱滞を解くとともに、肝血を滋養し肝気を柔順にし、心神を安定させる、《疏肝解鬱・養血安神》を行う。,"森 雄材,「漢方・中医学臨床マニュアル症状から診断・処方へ」, 医歯薬出版株式会社, 2004/02/01, ISBN 4263201957"
574ebe8e0ca14a579d4909ba034a259f,心脾両虚,過度の思慮や過労による心血の消耗と脾気の損傷で、心血と脾気の両面が不足し、脾による気血の生成も不足するため、心血の濡養が不十分になって心神が不安定になり不眠が生じる病態である。,精神・神経,眠りが浅く夢をよくみて夜間によく目が覚める、顔色につやがない・動悸・物忘れ・舌質が淡泊・脈が細いなどの心血虚の症状に、食欲不振・疲れやすい・倦怠感・日中に眠い・脈が弱いなどの脾気虚の症状を伴う。,益気健脾の人参・黄耆・白朮・炙甘草・大棗、養血安神の当帰・白芍・熟地黄・竜眼肉・酸棗仁・遠志・小麦など。,帰脾湯・加味帰脾湯・人参養栄湯・甘麦大棗湯,脾気を健運させて気血の産生を促し、心血を滋養して心神を安定させる、《益気健脾・補血養心》を行う。,"森 雄材,「漢方・中医学臨床マニュアル症状から診断・処方へ」, 医歯薬出版株式会社, 2004/02/01, ISBN 4263201957"
c7a325a5691f428a9679e0faa1f908b6,心陰虚,精神的ストレスの持続・慢性病・熱病などによって心の陰血が消耗し、陰血不足により陽気が有余して内熱が生じ、陰血による滋養が得られず、内熱が上擾するために心神が不安になり不眠を生じる,精神・神経,寝つきが悪い・眠りが浅い・夢をよくみる・すぐに目が覚めるなどとともに、動悸・焦燥感・物忘れ・体の熱感・頭面部のほてり・口内炎・舌質が絳・少苔～無苔・脈が浮で速く力がないなどがみられる。,滋陰養血の生地黄・熟地黄・玄参・天門冬・表門冬・白芍・当帰・養心安神の丹参・柏子仁・酸棗仁・五味子など。,天王補心丹,陰血を滋養することにより心神を安定させる、《滋陰養血・安神》を行う。,"森 雄材,「漢方・中医学臨床マニュアル症状から診断・処方へ」, 医歯薬出版株式会社, 2004/02/01, ISBN 4263201957"
5bd844406be746b4b6f1e9cbd6f11475,心腎不交,慢性病・熱病・過労・精神的ストレスの持続などで腎の陰液（腎水）が不足し、心の陰液を滋潤できないために心火が抑制されないまま上亢したり、心火が熾盛で次第に陰血を消耗して腎陰（腎水）が虚し、心火が上亢したまま下交せず、腎水が不足して心の陰液を助けないために、心と腎が交通しなくなって重度の不眠をきたす病態である。太陽が水を温めて水蒸気が上昇するように、心火（心陽）が下行して腎水（腎陰）を温め、腎水が上行して心の陰液を滋潤するという「水火既済」「心腎相交」の状態が正常であり、心火と腎水が相交しないこの病態を「心腎不交」という。,精神・神経,焦燥感があって夜通し眠れず、輾転反側（何度も寝がえりをうつ）し、動悸・口内炎・頭のふらつき・体の熱感・咽の渇き・腰や膝がだるく無力・舌質が絳・舌苔が少ない・脈が浮で速く力がないなどを伴う。,清心火の黄連・黄芩、滋腎陰の阿膠・生地黄・白芍、交通心腎の鶏子黄など。,黄連阿膠湯,心火を清すると同時に腎陰を滋潤して、水火既済を回復させる、《清心火・滋腎陰・交通心腎》を行う。,"森 雄材,「漢方・中医学臨床マニュアル症状から診断・処方へ」, 医歯薬出版株式会社, 2004/02/01, ISBN 4263201957"
fe036e42446148fea95d1f7d80900aaf,心胆虚怯,先天的虚弱・過労・高度の精神的ストレス・慢性病などのために虚弱で心神が不安なものが、驚いたり恐怖にさらされ、胆気が虚してさらに驚きやすくなり、心神不安が甚だしくなった病態である。,精神・神経,怖くてひとりで眠ることができず、ビクビクして驚きやすく、すぐに目が覚めておびえ、元気がない・動悸・落ち着かない・脈に力がないなどがみられる。,益気健脾の人参・茯苓・茯神、鎮心定驚の竜骨・牡蠣など。,安神定志丸,元気や機能を高めて驚かないようにし、心神を安定させる、《益気定驚・安神》を行う。,"森 雄材,「漢方・中医学臨床マニュアル症状から診断・処方へ」, 医歯薬出版株式会社, 2004/02/01, ISBN 4263201957"
bc9e0ecec2b84a77b172f66d735ddddb,痰濁上擾,偏食・嗜好・美食・食事の不規則・暴飲暴食・飲酒といった食習慣および体質などの関連で、脾の運輸が障害されて津液が停滞して水湿になり、水湿が集まって粘稠な痰となり、痰が内風や火熱とともに東部に上昇して擾乱し、めまいを引き起こす病態である。古人が「脾は生痰の源である」と指摘しているように、痰を生じる根本原因は、津液の吸収と運輸を主っている「脾」にある。古来「痰がなければめまいが起こらない」といわれてるように、水液が停滞して粘稠な塊になった「痰」が、何らかの機序で頭部に上昇し、内耳の平衡感覚や眼球の運動、さらに脳の機能などを阻害し、めまいを引き起こす状態に相当する。,精神・神経,,,,,"森 雄材,「漢方・中医学臨床マニュアル症状から診断・処方へ」, 医歯薬出版株式会社, 2004/02/01, ISBN 4263201957"
7383b290e20045a4a9e8f3c3dc8033d4,風痰上擾,疲労・緊張・いらいら・睡眠不足・暴飲暴食といった様々な原因で気機が失調して内風を生じ、体内に伏在している「痰」が内風とともに上昇し、めまいを発生させる病態である。,精神・神経,回転性の強いめまいで立っていられず、同時に激しい吐き気・嘔吐を伴い、普段から食欲不振・満腹・体が重だるい・頭が重い・軟便・白膩苔などを呈している。,熄風化痰の天麻・半夏、健脾祛湿の白朮・茯苓など。,半夏白朮天麻湯・釣藤散,内風を止め痰を除くとともに、津液の吸収や運輸の改善して痰の産生を防止する、《熄風化痰・健脾祛湿》を行う。,"森 雄材,「漢方・中医学臨床マニュアル症状から診断・処方へ」, 医歯薬出版株式会社, 2004/02/01, ISBN 4263201957"
55ced4a60f2a4e9c8eb219bf2e1957da,痰熱上擾,精神的ストレス・怒りなどによる肝火、あるいは辛辣なものの摂取や飲酒癖による胃熱などで、内生した火熱が伏在している「痰」と結びつき、東部に上昇してめまいを発生させる病態である。,精神・神経,めまい・吐き気・嘔吐とともに、いらいら・怒りっぽい・不眠・口が苦い・黄色く苦い吐物・胃痛・黄膩苔・脈がやや速いなどの痰熱の症状がみられる。,清熱化痰の竹筎・貝母・栝楼仁・胆南星、清熱の黄連・黄芩など。,温胆湯・黄連温胆湯,熱を冷まし興奮を静め痰を除く、《清熱化痰》を行う,"森 雄材,「漢方・中医学臨床マニュアル症状から診断・処方へ」, 医歯薬出版株式会社, 2004/02/01, ISBN 4263201957"
